{
  "$schema": "https://json-schema.org/draft/2020-12/schema",
  "$id": "https://mlabs.local/schemas/role.schema.json",
  "title": "Role definition",
  "description": "Canonical, hand-edited role definition consumed by lifecycle scripts. One file per role. Source of truth — not derived. All access (including M365 license SKUs via group-based licensing) is modeled as AD security or distribution group membership; no separate license or Entra-group fields. Provenance for changes lives in git history; reviewers populate the optional 'review' block to record formal review of the file's current state.",
  "type": "object",
  "additionalProperties": false,
  "required": [
    "schemaVersion",
    "roleId",
    "displayName",
    "department",
    "entitlements"
  ],
  "properties": {
    "schemaVersion": {
      "description": "Schema contract version. Bump on any breaking change.",
      "const": "2.0"
    },
    "roleId": {
      "description": "Stable identifier. Filename-safe slug, conventionally '<Department>-<TitleSlug>'.",
      "type": "string",
      "pattern": "^[A-Za-z0-9._-]+$",
      "minLength": 1
    },
    "displayName": {
      "description": "Human-readable role name — the canonical JobTitle. JobTitle is the role's identity.",
      "type": "string",
      "minLength": 1
    },
    "department": {
      "description": "Department slug. Used for namespacing roleId and human grouping.",
      "type": "string",
      "minLength": 1
    },
    "notes": {
      "description": "Free-text notes (exceptions, rationale for manual edits, hand-edit context).",
      "type": "string"
    },
    "review": {
      "description": "Most-recent formal review of this file's contents. Populate when an entitlement reviewer signs off on the role definition (recertification, post-change review, periodic re-attestation).",
      "type": "object",
      "additionalProperties": false,
      "properties": {
        "reviewedBy": {
          "description": "Identifier of the reviewer — typically email or GitHub handle.",
          "type": "string",
          "minLength": 1
        },
        "reviewedAt": {
          "type": "string",
          "format": "date-time"
        },
        "ticketRef": {
          "description": "Reference to the change/recertification ticket that justified or accompanied this review.",
          "type": "string"
        }
      }
    },
    "entitlements": {
      "description": "Canonical AD group memberships granted by the role. M365 license SKUs are conferred indirectly via group-based licensing on entries in securityGroups; do not enumerate them separately.",
      "type": "object",
      "additionalProperties": false,
      "required": ["securityGroups", "distributionGroups"],
      "properties": {
        "securityGroups": {
          "description": "AD security group DNs granted by the role.",
          "type": "array",
          "items": { "type": "string" },
          "uniqueItems": true
        },
        "distributionGroups": {
          "description": "AD distribution group DNs granted by the role.",
          "type": "array",
          "items": { "type": "string" },
          "uniqueItems": true
        }
      }
    }
  }
}
