{
  "schemaVersion": "2.0",
  "roleId": "IT-Associate_Information_Security_Analyst",
  "displayName": "Associate Information Security Analyst",
  "department": "IT",
  "entitlements": {
    "securityGroups": [
      "CN=AWS-769914725803-ADFS-Billing,OU=AWS Access Groups,OU=Security Groups,DC=mlabs,DC=com",
      "CN=AWS-880707781567-ADFS-Billing,OU=AWS Access Groups,OU=Security Groups,DC=mlabs,DC=com",
      "CN=AWS-948613896643-ADFS-Billing,OU=AWS Access Groups,OU=Security Groups,DC=mlabs,DC=com",
      "CN=Biscom URGENT,OU=Security Groups,DC=mlabs,DC=com",
      "CN=BiscomUsers,OU=Security Groups,DC=mlabs,DC=com",
      "CN=DruvaADSync,OU=Security Groups,DC=mlabs,DC=com",
      "CN=EMR Interfaces Folder Access,OU=Access Groups,OU=Security Groups,DC=mlabs,DC=com",
      "CN=ILIS Dev,OU=ILIS Non Prod Access Groups,OU=Security Groups,DC=mlabs,DC=com",
      "CN=ILIS QA,OU=ILIS Non Prod Access Groups,OU=Security Groups,DC=mlabs,DC=com",
      "CN=ILIS Sales User Dev,OU=ILIS Non Prod Access Groups,OU=Security Groups,DC=mlabs,DC=com",
      "CN=ILIS Sales User QA,OU=ILIS Non Prod Access Groups,OU=Security Groups,DC=mlabs,DC=com",
      "CN=InfoSec,OU=Security Groups,DC=mlabs,DC=com",
      "CN=IT Dept,OU=Security Groups,DC=mlabs,DC=com",
      "CN=IT Security Folder Access,OU=Access Groups,OU=Security Groups,DC=mlabs,DC=com",
      "CN=LF_AP_Approval,OU=Security Groups,DC=mlabs,DC=com",
      "CN=LF_EDDI_CS,OU=Security Groups,DC=mlabs,DC=com",
      "CN=LF_PGT_CS,OU=Security Groups,DC=mlabs,DC=com",
      "CN=LF_ProcessandSystemsExcellence,OU=Security Groups,DC=mlabs,DC=com",
      "CN=LF_SRDDTLAB,OU=Security Groups,DC=mlabs,DC=com",
      "CN=LF_SRDOffice,OU=Security Groups,DC=mlabs,DC=com",
      "CN=LFCash Read-Only,OU=Security Groups,DC=mlabs,DC=com",
      "CN=LFEddi-CS Access,OU=Security Groups,DC=mlabs,DC=com",
      "CN=LFLAB-DATAENTRY-Auditing,OU=Security Groups,DC=mlabs,DC=com",
      "CN=LFLAB-DATAENTRY-eReq,OU=Security Groups,DC=mlabs,DC=com",
      "CN=LFLAB-DATAENTRY-Scan,OU=Security Groups,DC=mlabs,DC=com",
      "CN=LFLAB-DATAENTRY,OU=Security Groups,DC=mlabs,DC=com",
      "CN=LFLAB-SUPERVISOR,OU=Security Groups,DC=mlabs,DC=com",
      "CN=LFRetrieve ClinicalSupport,OU=Security Groups,DC=mlabs,DC=com",
      "CN=LFRetrieve EOBs,OU=Security Groups,DC=mlabs,DC=com",
      "CN=LFRetrieve MedRecords,OU=Security Groups,DC=mlabs,DC=com",
      "CN=LFRetrieve Specimen Resolution,OU=Security Groups,DC=mlabs,DC=com",
      "CN=MH WLAN Access,OU=Security Groups,DC=mlabs,DC=com",
      "CN=Signature-Generic-Phone-Fax-Email-O365,OU=Signature-O365,OU=Signatures,OU=Security Groups,DC=mlabs,DC=com",
      "CN=SSRS MLIS Reports Data Entry Reporting Folder,OU=SQL Security Groups,OU=Security Groups,DC=mlabs,DC=com"
    ],
    "distributionGroups": [
      "CN=BT Software Subscriptions,OU=Distribution Groups,DC=mlabs,DC=com",
      "CN=Building 2,OU=Distribution Groups,DC=mlabs,DC=com",
      "CN=Millennium Health,OU=Distribution Groups,DC=mlabs,DC=com",
      "CN=Sales Status Changes,OU=Distribution Groups,DC=mlabs,DC=com",
      "CN=Software Purchases,OU=Distribution Groups,DC=mlabs,DC=com"
    ]
  }
}
