{
  "schemaVersion": "2.0",
  "roleId": "Lab_Operations-Clinical_Lab_Scientist",
  "displayName": "Clinical Lab Scientist",
  "department": "Lab_Operations",
  "entitlements": {
    "securityGroups": [
      "CN=BI_LabOperations,OU=BI,OU=Security Groups,DC=mlabs,DC=com",
      "CN=BLOCKYOUTUBE,OU=Security Groups,DC=mlabs,DC=com",
      "CN=BMRAM Application,OU=Security Groups,DC=mlabs,DC=com",
      "CN=LabDR,OU=Security Groups,DC=mlabs,DC=com",
      "CN=LCMS,OU=Security Groups,DC=mlabs,DC=com",
      "CN=MLVPN,OU=VPN Access Groups,OU=Security Groups,DC=mlabs,DC=com",
      "CN=Read-Only Lab Document Control Folder Access,OU=Access Groups,OU=Security Groups,DC=mlabs,DC=com",
      "CN=Signature-Default-O365,OU=Signature-O365,OU=Signatures,OU=Security Groups,DC=mlabs,DC=com",
      "CN=SpecimenHunterCLSAccessLA,OU=Security Groups,DC=mlabs,DC=com",
      "CN=VMS,OU=Security Groups,DC=mlabs,DC=com"
    ],
    "distributionGroups": [
      "CN=Building 1,OU=Distribution Groups,DC=mlabs,DC=com",
      "CN=CLS Lab,OU=Distribution Groups,DC=mlabs,DC=com",
      "CN=LCMS Errors,OU=Distribution Groups,DC=mlabs,DC=com",
      "CN=Main Lab,OU=Distribution Groups,DC=mlabs,DC=com",
      "CN=Millennium Health,OU=Distribution Groups,DC=mlabs,DC=com",
      "CN=Olympus,OU=Distribution Groups,DC=mlabs,DC=com"
    ]
  }
}
