{
  "schemaVersion": "2.0",
  "roleId": "Lab_Operations-Clinical_Lab_Scientist_II",
  "displayName": "Clinical Lab Scientist II",
  "department": "Lab_Operations",
  "entitlements": {
    "securityGroups": [
      "CN=Associate Scientist,OU=Security Groups,DC=mlabs,DC=com",
      "CN=BI_LabOperations,OU=BI,OU=Security Groups,DC=mlabs,DC=com",
      "CN=BiscomUsers,OU=Security Groups,DC=mlabs,DC=com",
      "CN=BLOCKYOUTUBE,OU=Security Groups,DC=mlabs,DC=com",
      "CN=BMRAM Application,OU=Security Groups,DC=mlabs,DC=com",
      "CN=CLS,OU=Security Groups,DC=mlabs,DC=com",
      "CN=DAR UDT Rework Approvals,OU=Security Groups,DC=mlabs,DC=com",
      "CN=EP Evaluator,OU=Security Groups,DC=mlabs,DC=com",
      "CN=Hamilton,OU=Security Groups,DC=mlabs,DC=com",
      "CN=Lab Document Control Folder Access,OU=Access Groups,OU=Security Groups,DC=mlabs,DC=com",
      "CN=LabDR,OU=Security Groups,DC=mlabs,DC=com",
      "CN=LabSummaryWorkbook AscentConfigFiles Folder Access,OU=Access Groups,OU=Security Groups,DC=mlabs,DC=com",
      "CN=LCMS Users,OU=Security Groups,DC=mlabs,DC=com",
      "CN=List-Only Lab Document Control Folder Access,OU=Access Groups,OU=Security Groups,DC=mlabs,DC=com",
      "CN=MH WLAN Access,OU=Security Groups,DC=mlabs,DC=com",
      "CN=MI-LABSUPPORT,OU=Security Groups,DC=mlabs,DC=com",
      "CN=MITurV2,OU=Security Groups,DC=mlabs,DC=com",
      "CN=Operational Excellence Folder Access,OU=Access Groups,OU=Security Groups,DC=mlabs,DC=com",
      "CN=Read-Only Lab Document Control Folder Access,OU=Access Groups,OU=Security Groups,DC=mlabs,DC=com",
      "CN=Signature-Default-Ext-Fax-O365,OU=Signature-O365,OU=Signatures,OU=Security Groups,DC=mlabs,DC=com",
      "CN=SSRS MLIS Reports Data Entry Reporting Folder,OU=SQL Security Groups,OU=Security Groups,DC=mlabs,DC=com",
      "CN=SSRS MLIS Reports Genetics Lab Folder,OU=SQL Security Groups,OU=Security Groups,DC=mlabs,DC=com",
      "CN=SSRS MLIS Reports Lab Folder,OU=SQL Security Groups,OU=Security Groups,DC=mlabs,DC=com",
      "CN=Validation UDT,OU=Security Groups,DC=mlabs,DC=com",
      "CN=VMS - Data Analysis,OU=Security Groups,DC=mlabs,DC=com",
      "CN=VMS - Data Review,OU=Security Groups,DC=mlabs,DC=com",
      "CN=VMS,OU=Security Groups,DC=mlabs,DC=com"
    ],
    "distributionGroups": [
      "CN=Building 1,OU=Distribution Groups,DC=mlabs,DC=com",
      "CN=Clinical Labs Morale Committee,OU=Distribution Groups,DC=mlabs,DC=com",
      "CN=CLS Data Review,OU=Distribution Groups,DC=mlabs,DC=com",
      "CN=CLS Lab,OU=Distribution Groups,DC=mlabs,DC=com",
      "CN=DAR,OU=Distribution Groups,DC=mlabs,DC=com",
      "CN=Millennium Health,OU=Distribution Groups,DC=mlabs,DC=com",
      "CN=Morning AR,OU=Distribution Groups,DC=mlabs,DC=com",
      "CN=QC,OU=Distribution Groups,DC=mlabs,DC=com",
      "CN=Send Outs,OU=Distribution Groups,DC=mlabs,DC=com",
      "CN=Trainers Lab,OU=Distribution Groups,DC=mlabs,DC=com"
    ]
  }
}
