{
  "schemaVersion": "2.0",
  "roleId": "IT-EMR_Interface_Implementation_Analyst",
  "displayName": "EMR Interface Implementation Analyst",
  "department": "IT",
  "entitlements": {
    "securityGroups": [
      "CN=AD_BUSINESS_TECH,OU=Security Groups,DC=mlabs,DC=com",
      "CN=AD_CONTRACT_MANAGER,OU=Security Groups,DC=mlabs,DC=com",
      "CN=BI_BT,OU=BI,OU=Security Groups,DC=mlabs,DC=com",
      "CN=BiscomUsers,OU=Security Groups,DC=mlabs,DC=com",
      "CN=BT-FileXfers Folder Access,OU=Access Groups,OU=Security Groups,DC=mlabs,DC=com",
      "CN=DCM_BT Services,OU=Security Groups,DC=mlabs,DC=com",
      "CN=EMR Interfaces Folder Access,OU=Access Groups,OU=Security Groups,DC=mlabs,DC=com",
      "CN=HL7WorkArea Folder Access,OU=Access Groups,OU=Security Groups,DC=mlabs,DC=com",
      "CN=ILIS Dev,OU=ILIS Non Prod Access Groups,OU=Security Groups,DC=mlabs,DC=com",
      "CN=ILIS QA,OU=ILIS Non Prod Access Groups,OU=Security Groups,DC=mlabs,DC=com",
      "CN=ILIS Sales User Dev,OU=ILIS Non Prod Access Groups,OU=Security Groups,DC=mlabs,DC=com",
      "CN=ILIS Sales User QA,OU=ILIS Non Prod Access Groups,OU=Security Groups,DC=mlabs,DC=com",
      "CN=IT Dept,OU=Security Groups,DC=mlabs,DC=com",
      "CN=IT-Dev,OU=Security Groups,DC=mlabs,DC=com",
      "CN=IT-EMR,OU=Security Groups,DC=mlabs,DC=com",
      "CN=Jira User Access,OU=Security Groups,DC=mlabs,DC=com",
      "CN=List-Only Data Services Folder Access,OU=Access Groups,OU=Security Groups,DC=mlabs,DC=com",
      "CN=List-Only MHFS01 MLIS Interface Folder Access,OU=Access Groups,OU=Security Groups,DC=mlabs,DC=com",
      "CN=List-Only MLIS Interface Folder Access,OU=Access Groups,OU=Security Groups,DC=mlabs,DC=com",
      "CN=MH WLAN Access,OU=Security Groups,DC=mlabs,DC=com",
      "CN=MHFS01 QA Folders DxPortal Interface Folder Access,OU=Access Groups,OU=Security Groups,DC=mlabs,DC=com",
      "CN=MLIS Interface-QA Folders-Main 1-UHC Access,OU=Access Groups,OU=Security Groups,DC=mlabs,DC=com",
      "CN=QA Folders Folder Access,OU=Access Groups,OU=Security Groups,DC=mlabs,DC=com",
      "CN=QA SDLC MLIS Interface Folder Access,OU=Access Groups,OU=Security Groups,DC=mlabs,DC=com",
      "CN=Read-Only MHFS01 DxPortal Interface Folder Access,OU=Access Groups,OU=Security Groups,DC=mlabs,DC=com",
      "CN=Read-Only MHFS01 QA Folders Folder Access,OU=Access Groups,OU=Security Groups,DC=mlabs,DC=com",
      "CN=Read-Only MHFS01 TelcorImport Production Folders Folder Access,OU=Access Groups,OU=Security Groups,DC=mlabs,DC=com",
      "CN=Read-Only MHFS01 TelcorImport QA Folders Folder Access,OU=Access Groups,OU=Security Groups,DC=mlabs,DC=com",
      "CN=Read-Only MHFS01 TelcorReceivedbox Production Folders Folder Acc,OU=Access Groups,OU=Security Groups,DC=mlabs,DC=com",
      "CN=Read-Only MHFS01 TelcorReceivedbox QA Folders Folder Access,OU=Access Groups,OU=Security Groups,DC=mlabs,DC=com",
      "CN=Read-Only TelcorReceivedbox Productions Folders Folder Access,OU=Access Groups,OU=Security Groups,DC=mlabs,DC=com",
      "CN=Signature-Generic-Phone-Fax-Email-O365,OU=Signature-O365,OU=Signatures,OU=Security Groups,DC=mlabs,DC=com",
      "CN=SN EMR Interfaces,OU=ServiceNow Groups,OU=Security Groups,DC=mlabs,DC=com",
      "CN=SP_EMR Write,OU=Security Groups,DC=mlabs,DC=com",
      "CN=SSRS MLIS Reports Data Entry Reporting Folder,OU=SQL Security Groups,OU=Security Groups,DC=mlabs,DC=com"
    ],
    "distributionGroups": [
      "CN=EMR Interfaces,OU=Distribution Groups,DC=mlabs,DC=com",
      "CN=Millennium Health,OU=Distribution Groups,DC=mlabs,DC=com",
      "CN=MOL Support Staging,OU=Distribution Groups,DC=mlabs,DC=com"
    ]
  }
}
