{
  "schemaVersion": "2.0",
  "roleId": "Clinical_Affairs-Director_Clinical_Affairs",
  "displayName": "Director, Clinical Affairs",
  "department": "Clinical_Affairs",
  "entitlements": {
    "securityGroups": [
      "CN=BiscomUsers,OU=Security Groups,DC=mlabs,DC=com",
      "CN=BTC_Authentication,OU=Security Groups,DC=mlabs,DC=com",
      "CN=BTC_CI_Clinical_Education_Research_Training,OU=Security Groups,DC=mlabs,DC=com",
      "CN=BTC_Clinical_Education_Research_Training,OU=Security Groups,DC=mlabs,DC=com",
      "CN=BTC_Clinical_References,OU=Security Groups,DC=mlabs,DC=com",
      "CN=BTC_Sales_Reps,OU=Security Groups,DC=mlabs,DC=com",
      "CN=MH WLAN Access,OU=Security Groups,DC=mlabs,DC=com",
      "CN=Shared Drive Folder Access,OU=Access Groups,OU=Security Groups,DC=mlabs,DC=com",
      "CN=Signature-Default-Fax-Cell-O365,OU=Signature-O365,OU=Signatures,OU=Security Groups,DC=mlabs,DC=com",
      "CN=SSRS MLIS Reports Custom Reports Folder,OU=SQL Security Groups,OU=Security Groups,DC=mlabs,DC=com"
    ],
    "distributionGroups": [
      "CN=Blitz Veterans,OU=Distribution Groups,DC=mlabs,DC=com",
      "CN=Clinical Affairs,OU=Distribution Groups,DC=mlabs,DC=com",
      "CN=Clinical Educator,OU=Distribution Groups,DC=mlabs,DC=com",
      "CN=Field Employees,OU=Distribution Groups,DC=mlabs,DC=com",
      "CN=Millennium Health,OU=Distribution Groups,DC=mlabs,DC=com",
      "CN=Tox,OU=Distribution Groups,DC=mlabs,DC=com"
    ]
  }
}
