{
  "schemaVersion": "2.0",
  "roleId": "Lab_Operations-Clinical_Lab_Scientist_Lead",
  "displayName": "Clinical Lab Scientist Lead",
  "department": "Lab_Operations",
  "entitlements": {
    "securityGroups": [
      "CN=BI_LabOperations,OU=BI,OU=Security Groups,DC=mlabs,DC=com",
      "CN=BiscomUsers,OU=Security Groups,DC=mlabs,DC=com",
      "CN=BLOCKYOUTUBE,OU=Security Groups,DC=mlabs,DC=com",
      "CN=BMRAM Application,OU=Security Groups,DC=mlabs,DC=com",
      "CN=CLS,OU=Security Groups,DC=mlabs,DC=com",
      "CN=DAR UDT Rework Approvals,OU=Security Groups,DC=mlabs,DC=com",
      "CN=Data Analysis and Review,OU=Security Groups,DC=mlabs,DC=com",
      "CN=LabDR,OU=Security Groups,DC=mlabs,DC=com",
      "CN=MLVPN,OU=VPN Access Groups,OU=Security Groups,DC=mlabs,DC=com",
      "CN=Read-Only Lab Document Control Folder Access,OU=Access Groups,OU=Security Groups,DC=mlabs,DC=com",
      "CN=Signature-Default-Ext-Fax-O365,OU=Signature-O365,OU=Signatures,OU=Security Groups,DC=mlabs,DC=com",
      "CN=SSRS MLIS Reports Lab Folder,OU=SQL Security Groups,OU=Security Groups,DC=mlabs,DC=com",
      "CN=VMS - Data Analysis,OU=Security Groups,DC=mlabs,DC=com",
      "CN=VMS - Data Review,OU=Security Groups,DC=mlabs,DC=com",
      "CN=VMS,OU=Security Groups,DC=mlabs,DC=com"
    ],
    "distributionGroups": [
      "CN=Building 1,OU=Distribution Groups,DC=mlabs,DC=com",
      "CN=CLS Data Review,OU=Distribution Groups,DC=mlabs,DC=com",
      "CN=CLS Lab,OU=Distribution Groups,DC=mlabs,DC=com",
      "CN=CLS Support,OU=Distribution Groups,DC=mlabs,DC=com",
      "CN=CR Communication,OU=Distribution Groups,DC=mlabs,DC=com",
      "CN=DAR,OU=Distribution Groups,DC=mlabs,DC=com",
      "CN=Evening AR,OU=Distribution Groups,DC=mlabs,DC=com",
      "CN=Millennium Health,OU=Distribution Groups,DC=mlabs,DC=com",
      "CN=Morning AR,OU=Distribution Groups,DC=mlabs,DC=com"
    ]
  }
}
