{
  "schemaVersion": "2.0",
  "roleId": "IT-Sr_Tableau_Developer",
  "displayName": "Sr. Tableau Developer",
  "department": "IT",
  "entitlements": {
    "securityGroups": [
      "CN=AWS-769914725803-ADFS-S3-Admin,OU=AWS Access Groups,OU=Security Groups,DC=mlabs,DC=com",
      "CN=BI_BT,OU=BI,OU=Security Groups,DC=mlabs,DC=com",
      "CN=BiscomUsers,OU=Security Groups,DC=mlabs,DC=com",
      "CN=Data Warehouse Folder Access,OU=Access Groups,OU=Security Groups,DC=mlabs,DC=com",
      "CN=DWBI Dev,OU=BI,OU=Security Groups,DC=mlabs,DC=com",
      "CN=ILIS Dev,OU=ILIS Non Prod Access Groups,OU=Security Groups,DC=mlabs,DC=com",
      "CN=ILIS QA,OU=ILIS Non Prod Access Groups,OU=Security Groups,DC=mlabs,DC=com",
      "CN=ILIS Sales User Dev,OU=ILIS Non Prod Access Groups,OU=Security Groups,DC=mlabs,DC=com",
      "CN=ILIS Sales User QA,OU=ILIS Non Prod Access Groups,OU=Security Groups,DC=mlabs,DC=com",
      "CN=IT Dept,OU=Security Groups,DC=mlabs,DC=com",
      "CN=List-Only Billing Folder Access,OU=Access Groups,OU=Security Groups,DC=mlabs,DC=com",
      "CN=MH WLAN Access,OU=Security Groups,DC=mlabs,DC=com",
      "CN=MLIS SSRS Admin,OU=Security Groups,DC=mlabs,DC=com",
      "CN=Signature-Default-O365,OU=Signature-O365,OU=Signatures,OU=Security Groups,DC=mlabs,DC=com",
      "CN=SN Data Warehouse,OU=ServiceNow Groups,OU=Security Groups,DC=mlabs,DC=com",
      "CN=SQL_BT_DataServices,OU=SQL Security Groups,OU=Security Groups,DC=mlabs,DC=com",
      "CN=TableauAdmin,OU=Security Groups,DC=mlabs,DC=com"
    ],
    "distributionGroups": [
      "CN=BI Support,OU=Distribution Groups,DC=mlabs,DC=com",
      "CN=Building 2,OU=Distribution Groups,DC=mlabs,DC=com",
      "CN=Millennium Health,OU=Distribution Groups,DC=mlabs,DC=com",
      "CN=Tableau Support,OU=Distribution Groups,DC=mlabs,DC=com"
    ]
  }
}
