{
  "schemaVersion": "2.0",
  "roleId": "Clinical_Affairs-VP_Scientific_Affairs_And_Head_of_Clinical_Data_Programs",
  "displayName": "VP, Scientific Affairs & Head of Clinical Data Programs",
  "department": "Clinical_Affairs",
  "entitlements": {
    "securityGroups": [
      "CN=BI_ClinicalAffairs,OU=BI,OU=Security Groups,DC=mlabs,DC=com",
      "CN=BiscomUsers,OU=Security Groups,DC=mlabs,DC=com",
      "CN=BTC_Authentication,OU=Security Groups,DC=mlabs,DC=com",
      "CN=BTC_CI_Clinical_Education_Research_Training,OU=Security Groups,DC=mlabs,DC=com",
      "CN=BTC_Clinical_Education_Research_Training,OU=Security Groups,DC=mlabs,DC=com",
      "CN=BTC_Clinical_References,OU=Security Groups,DC=mlabs,DC=com",
      "CN=Clinical Excellence Committee Folder Access,OU=Access Groups,OU=Security Groups,DC=mlabs,DC=com",
      "CN=DxWound Medical Policy Documents Folder Access,OU=Access Groups,OU=Security Groups,DC=mlabs,DC=com",
      "CN=MH WLAN Access,OU=Security Groups,DC=mlabs,DC=com",
      "CN=Sales Roster Folder Access,OU=Access Groups,OU=Security Groups,DC=mlabs,DC=com",
      "CN=San Diego Leadership,OU=Security Groups,DC=mlabs,DC=com",
      "CN=Signature-Default-Fax-Cell-O365,OU=Signature-O365,OU=Signatures,OU=Security Groups,DC=mlabs,DC=com",
      "CN=SSRS MLIS Reports Custom Reports Folder,OU=SQL Security Groups,OU=Security Groups,DC=mlabs,DC=com"
    ],
    "distributionGroups": [
      "CN=Clinical Affairs,OU=Distribution Groups,DC=mlabs,DC=com",
      "CN=Clinical Educator,OU=Distribution Groups,DC=mlabs,DC=com",
      "CN=CR Communication,OU=Distribution Groups,DC=mlabs,DC=com",
      "CN=Field Employees,OU=Distribution Groups,DC=mlabs,DC=com",
      "CN=Managed Markets Announcements,OU=Distribution Groups,DC=mlabs,DC=com",
      "CN=MH Leaders,OU=Distribution Groups,DC=mlabs,DC=com",
      "CN=MH Senior Leadership,OU=Distribution Groups,DC=mlabs,DC=com",
      "CN=Millennium Health,OU=Distribution Groups,DC=mlabs,DC=com"
    ]
  }
}
