{
  "schemaVersion": "2.0",
  "roleId": "Lab_Operations-Scientific_Manager_Toxicology",
  "displayName": "Scientific Manager, Toxicology",
  "department": "Lab_Operations",
  "entitlements": {
    "securityGroups": [
      "CN=BI_LabOperations,OU=BI,OU=Security Groups,DC=mlabs,DC=com",
      "CN=BiscomUsers,OU=Security Groups,DC=mlabs,DC=com",
      "CN=BLOCKYOUTUBE,OU=Security Groups,DC=mlabs,DC=com",
      "CN=BMRAM Application,OU=Security Groups,DC=mlabs,DC=com",
      "CN=BTC_Authentication,OU=Security Groups,DC=mlabs,DC=com",
      "CN=BTC_Clinical Support,OU=Security Groups,DC=mlabs,DC=com",
      "CN=BTC_Marketing_Team,OU=Security Groups,DC=mlabs,DC=com",
      "CN=Hamilton,OU=Security Groups,DC=mlabs,DC=com",
      "CN=Instruments Lab Secure Transfer Folder Acces,OU=Access Groups,OU=Security Groups,DC=mlabs,DC=com",
      "CN=Lab Document Control Folder Access,OU=Access Groups,OU=Security Groups,DC=mlabs,DC=com",
      "CN=LAB Supervisors,OU=Security Groups,DC=mlabs,DC=com",
      "CN=LabDR,OU=Security Groups,DC=mlabs,DC=com",
      "CN=LCMS,OU=Security Groups,DC=mlabs,DC=com",
      "CN=LFLAB-DATAENTRY-eReq,OU=Security Groups,DC=mlabs,DC=com",
      "CN=LFLAB-DATAENTRY,OU=Security Groups,DC=mlabs,DC=com",
      "CN=MH WLAN Access,OU=Security Groups,DC=mlabs,DC=com",
      "CN=MI-LABMANAGEMENT,OU=Security Groups,DC=mlabs,DC=com",
      "CN=MITurV2,OU=Security Groups,DC=mlabs,DC=com",
      "CN=Read-Only Lab Document Control Folder Access,OU=Access Groups,OU=Security Groups,DC=mlabs,DC=com",
      "CN=San Diego Leadership,OU=Security Groups,DC=mlabs,DC=com",
      "CN=Signature-Generic-Phone-Fax-Email-O365,OU=Signature-O365,OU=Signatures,OU=Security Groups,DC=mlabs,DC=com",
      "CN=SSRS MLIS Reports Custom Reports Folder,OU=SQL Security Groups,OU=Security Groups,DC=mlabs,DC=com",
      "CN=SSRS MLIS Reports Data Entry Reporting Folder,OU=SQL Security Groups,OU=Security Groups,DC=mlabs,DC=com",
      "CN=SSRS MLIS Reports eForms Reports Folder,OU=SQL Security Groups,OU=Security Groups,DC=mlabs,DC=com",
      "CN=SSRS MLIS Reports Lab Folder,OU=SQL Security Groups,OU=Security Groups,DC=mlabs,DC=com",
      "CN=Supervisors Lab,OU=Security Groups,DC=mlabs,DC=com",
      "CN=Supervisors PA,OU=Security Groups,DC=mlabs,DC=com",
      "CN=UDT Repeats Manager Application Access,OU=Security Groups,DC=mlabs,DC=com",
      "CN=VMS - Data Review,OU=Security Groups,DC=mlabs,DC=com",
      "CN=VMS,OU=Security Groups,DC=mlabs,DC=com"
    ],
    "distributionGroups": [
      "CN=Building 1,OU=Distribution Groups,DC=mlabs,DC=com",
      "CN=CLS Data Review,OU=Distribution Groups,DC=mlabs,DC=com",
      "CN=CLS Lab,OU=Distribution Groups,DC=mlabs,DC=com",
      "CN=CLS Olympus,OU=Distribution Groups,DC=mlabs,DC=com",
      "CN=CLS Support,OU=Distribution Groups,DC=mlabs,DC=com",
      "CN=Instruments Lab,OU=Distribution Groups,DC=mlabs,DC=com",
      "CN=LCMS Errors,OU=Distribution Groups,DC=mlabs,DC=com",
      "CN=Millennium Health,OU=Distribution Groups,DC=mlabs,DC=com",
      "CN=Morning AR,OU=Distribution Groups,DC=mlabs,DC=com",
      "CN=NetSuite Approvers,OU=Distribution Groups,DC=mlabs,DC=com",
      "CN=Olympus,OU=Distribution Groups,DC=mlabs,DC=com",
      "CN=QC,OU=Distribution Groups,DC=mlabs,DC=com",
      "CN=UDT Lab,OU=Distribution Groups,DC=mlabs,DC=com"
    ]
  }
}
