{
  "schemaVersion": "2.0",
  "roleId": "IT-SharePoint_Developer",
  "displayName": "SharePoint Developer",
  "department": "IT",
  "entitlements": {
    "securityGroups": [
      "CN=Data Warehouse Folder Access,OU=Access Groups,OU=Security Groups,DC=mlabs,DC=com",
      "CN=DruvaADSync,OU=Security Groups,DC=mlabs,DC=com",
      "CN=MH WLAN Access,OU=Security Groups,DC=mlabs,DC=com",
      "CN=Signature-Default-O365,OU=Signature-O365,OU=Signatures,OU=Security Groups,DC=mlabs,DC=com",
      "CN=Temp Users,OU=Security Groups,DC=mlabs,DC=com"
    ],
    "distributionGroups": []
  }
}
