{
  "schemaVersion": "2.0",
  "roleId": "Lab_Operations-Manager_Lab_Specimen_Processing",
  "displayName": "Manager, Lab Specimen Processing",
  "department": "Lab_Operations",
  "entitlements": {
    "securityGroups": [
      "CN=Admin Alert Folder Access,OU=Access Groups,OU=Security Groups,DC=mlabs,DC=com",
      "CN=Admin Dept Laserfiche Workflow Folder Access,OU=Access Groups,OU=Security Groups,DC=mlabs,DC=com",
      "CN=Audits Folder Access,OU=Access Groups,OU=Security Groups,DC=mlabs,DC=com",
      "CN=BI_LabOperations,OU=BI,OU=Security Groups,DC=mlabs,DC=com",
      "CN=BLOCKYOUTUBE,OU=Security Groups,DC=mlabs,DC=com",
      "CN=BMRAM Application,OU=Security Groups,DC=mlabs,DC=com",
      "CN=E-Req practices Folder Access,OU=Access Groups,OU=Security Groups,DC=mlabs,DC=com",
      "CN=ILIS Prod,OU=ILIS Prod Access Groups,OU=Security Groups,DC=mlabs,DC=com",
      "CN=ILIS UAT Non Prod,OU=ILIS Non Prod Access Groups,OU=Security Groups,DC=mlabs,DC=com",
      "CN=LF_Lab_Ereq_Import,OU=Security Groups,DC=mlabs,DC=com",
      "CN=LF_PGTLab,OU=Security Groups,DC=mlabs,DC=com",
      "CN=LF_QFAdmin,OU=Security Groups,DC=mlabs,DC=com",
      "CN=LFLAB-DATAENTRY-eReq,OU=Security Groups,DC=mlabs,DC=com",
      "CN=LFLAB-DATAENTRY-Scan,OU=Security Groups,DC=mlabs,DC=com",
      "CN=LFLAB-DATAENTRY,OU=Security Groups,DC=mlabs,DC=com",
      "CN=LFLAB-SUPERVISOR,OU=Security Groups,DC=mlabs,DC=com",
      "CN=LFRetrieve MedRecords,OU=Security Groups,DC=mlabs,DC=com",
      "CN=LFScan MedRecords,OU=Security Groups,DC=mlabs,DC=com",
      "CN=LFScan_eReq/HL7,OU=Security Groups,DC=mlabs,DC=com",
      "CN=LSP Lead Folder Access,OU=Access Groups,OU=Security Groups,DC=mlabs,DC=com",
      "CN=LSP Supervisors,OU=Security Groups,DC=mlabs,DC=com",
      "CN=MH WLAN Access,OU=Security Groups,DC=mlabs,DC=com",
      "CN=Read-Only EMR Interfaces Folder Access,OU=Access Groups,OU=Security Groups,DC=mlabs,DC=com",
      "CN=Read-Only Lab Document Control Folder Access,OU=Access Groups,OU=Security Groups,DC=mlabs,DC=com",
      "CN=San Diego Leadership,OU=Security Groups,DC=mlabs,DC=com",
      "CN=Signature-Generic-Phone-Fax-Email-O365,OU=Signature-O365,OU=Signatures,OU=Security Groups,DC=mlabs,DC=com",
      "CN=SP_EMR Read,OU=Security Groups,DC=mlabs,DC=com",
      "CN=SR Leads Folder Access,OU=Access Groups,OU=Security Groups,DC=mlabs,DC=com",
      "CN=SRD Folder Access,OU=Access Groups,OU=Security Groups,DC=mlabs,DC=com",
      "CN=SRD Leads Folder Access,OU=Access Groups,OU=Security Groups,DC=mlabs,DC=com",
      "CN=SSRS MLIS Reports Data Entry Reporting Folder,OU=SQL Security Groups,OU=Security Groups,DC=mlabs,DC=com",
      "CN=SSRS MLIS Reports Lab Folder,OU=SQL Security Groups,OU=Security Groups,DC=mlabs,DC=com",
      "CN=Supervisors in Clinical Laboratory Folder Access,OU=Access Groups,OU=Security Groups,DC=mlabs,DC=com",
      "CN=Supervisors Lab,OU=Security Groups,DC=mlabs,DC=com",
      "CN=Test Drive Docs Folder Access,OU=Access Groups,OU=Security Groups,DC=mlabs,DC=com",
      "CN=Workers Comp Folder Access - Shared,OU=Access Groups,OU=Security Groups,DC=mlabs,DC=com"
    ],
    "distributionGroups": [
      "CN=Building 1,OU=Distribution Groups,DC=mlabs,DC=com",
      "CN=Leads-SRL,OU=Distribution Groups,DC=mlabs,DC=com",
      "CN=Millennium Health,OU=Distribution Groups,DC=mlabs,DC=com",
      "CN=Specimen Resolution - Lab,OU=Distribution Groups,DC=mlabs,DC=com",
      "CN=Supervisor Training Program,OU=Distribution Groups,DC=mlabs,DC=com",
      "CN=True QNS,OU=Distribution Groups,DC=mlabs,DC=com"
    ]
  }
}
