{
  "schemaVersion": "2.0",
  "roleId": "IT-Computer_Technician",
  "displayName": "Computer Technician",
  "department": "IT",
  "entitlements": {
    "securityGroups": [
      "CN=ActiveSync Device Management,OU=Microsoft Exchange Security Groups,DC=mlabs,DC=com",
      "CN=ADAuditTech,OU=Security Groups,DC=mlabs,DC=com",
      "CN=BI_BT,OU=BI,OU=Security Groups,DC=mlabs,DC=com",
      "CN=BiscomUsers,OU=Security Groups,DC=mlabs,DC=com",
      "CN=BTC_Authentication,OU=Security Groups,DC=mlabs,DC=com",
      "CN=Facilities Folder Access,OU=Access Groups,OU=Security Groups,DC=mlabs,DC=com",
      "CN=ILIS Dev,OU=ILIS Non Prod Access Groups,OU=Security Groups,DC=mlabs,DC=com",
      "CN=ILIS Okta Support Prod,OU=ILIS Prod Access Groups,OU=Security Groups,DC=mlabs,DC=com",
      "CN=ILIS QA,OU=ILIS Non Prod Access Groups,OU=Security Groups,DC=mlabs,DC=com",
      "CN=IT Dept,OU=Security Groups,DC=mlabs,DC=com",
      "CN=IT Exchange User Management,OU=Microsoft Exchange Security Groups,DC=mlabs,DC=com",
      "CN=IT Support Technician,OU=Security Groups,DC=mlabs,DC=com",
      "CN=MH WLAN Access,OU=Security Groups,DC=mlabs,DC=com",
      "CN=NetworkIT,OU=Security Groups,DC=mlabs,DC=com",
      "CN=Remote Assistant,OU=Security Groups,DC=mlabs,DC=com",
      "CN=Signature-Generic-Phone-Fax-Email-O365,OU=Signature-O365,OU=Signatures,OU=Security Groups,DC=mlabs,DC=com",
      "CN=SN Tech Support,OU=ServiceNow Groups,OU=Security Groups,DC=mlabs,DC=com"
    ],
    "distributionGroups": [
      "CN=Building 2,OU=Distribution Groups,DC=mlabs,DC=com",
      "CN=CompuTrace,OU=Distribution Groups,DC=mlabs,DC=com",
      "CN=Millennium Health,OU=Distribution Groups,DC=mlabs,DC=com"
    ]
  }
}
