{
  "schemaVersion": "2.0",
  "roleId": "Commercial_Operations-Customer_Service_Production_Supervisor",
  "displayName": "Customer Service, Production Supervisor",
  "department": "Commercial_Operations",
  "entitlements": {
    "securityGroups": [
      "CN=BI_ClientServices,OU=BI,OU=Security Groups,DC=mlabs,DC=com",
      "CN=Biscom URGENT,OU=Security Groups,DC=mlabs,DC=com",
      "CN=BiscomUsers,OU=Security Groups,DC=mlabs,DC=com",
      "CN=BTC_Clinical Support,OU=Security Groups,DC=mlabs,DC=com",
      "CN=Client Services Dept,OU=Security Groups,DC=mlabs,DC=com",
      "CN=Duo MFA Test,OU=Duo Access Groups,OU=Security Groups,DC=mlabs,DC=com",
      "CN=Duo Workable Access,OU=Duo Access Groups,OU=Security Groups,DC=mlabs,DC=com",
      "CN=E-Req practices Folder Access,OU=Access Groups,OU=Security Groups,DC=mlabs,DC=com",
      "CN=ILIS QA,OU=ILIS Non Prod Access Groups,OU=Security Groups,DC=mlabs,DC=com",
      "CN=Inhouse Support,OU=Security Groups,DC=mlabs,DC=com",
      "CN=LF_Customer_Service_Users,OU=Security Groups,DC=mlabs,DC=com",
      "CN=LF_EDDI_CS,OU=Security Groups,DC=mlabs,DC=com",
      "CN=LF_LabClinicalSupport,OU=Security Groups,DC=mlabs,DC=com",
      "CN=LF_PGT_CS,OU=Security Groups,DC=mlabs,DC=com",
      "CN=LFBILLING_Accession_Access,OU=Security Groups,DC=mlabs,DC=com",
      "CN=LFEddi-CS Access,OU=Security Groups,DC=mlabs,DC=com",
      "CN=LFRetrieve ClinicalSupport,OU=Security Groups,DC=mlabs,DC=com",
      "CN=LFRetrieve PGT,OU=Security Groups,DC=mlabs,DC=com",
      "CN=LFRetrieve SalesSupport,OU=Security Groups,DC=mlabs,DC=com",
      "CN=LFScan MedRecords,OU=Security Groups,DC=mlabs,DC=com",
      "CN=MH WLAN Access,OU=Security Groups,DC=mlabs,DC=com",
      "CN=MLVPN,OU=VPN Access Groups,OU=Security Groups,DC=mlabs,DC=com",
      "CN=Read-Only Lab Document Control Folder Access,OU=Access Groups,OU=Security Groups,DC=mlabs,DC=com",
      "CN=Read-Only Sales Roster Folder Access,OU=Access Groups,OU=Security Groups,DC=mlabs,DC=com",
      "CN=Sales Operations Dept,OU=Security Groups,DC=mlabs,DC=com",
      "CN=Sales Support Dept,OU=Security Groups,DC=mlabs,DC=com",
      "CN=Sales Support Folder Access,OU=Access Groups,OU=Security Groups,DC=mlabs,DC=com",
      "CN=Salesforce Inbox O365 Access,OU=Security Groups,DC=mlabs,DC=com",
      "CN=SalesForceUsers,OU=Security Groups,DC=mlabs,DC=com",
      "CN=SalesOps_Users,OU=Security Groups,DC=mlabs,DC=com",
      "CN=Signature-Generic-Phone-Fax-Email-O365,OU=Signature-O365,OU=Signatures,OU=Security Groups,DC=mlabs,DC=com",
      "CN=SSRS MLIS Reports Data Entry Reporting Folder,OU=SQL Security Groups,OU=Security Groups,DC=mlabs,DC=com"
    ],
    "distributionGroups": [
      "CN=CustomerServiceLeadership,OU=Distribution Groups,DC=mlabs,DC=com",
      "CN=CustomerServiceTeam,OU=Distribution Groups,DC=mlabs,DC=com",
      "CN=Millennium Health,OU=Distribution Groups,DC=mlabs,DC=com",
      "CN=SSLiaisons,OU=Distribution Groups,DC=mlabs,DC=com"
    ]
  }
}
