{
  "schemaVersion": "2.0",
  "roleId": "IT-Systems_Engineer",
  "displayName": "Systems Engineer",
  "department": "IT",
  "entitlements": {
    "securityGroups": [
      "CN=ActiveSync Device Management,OU=Microsoft Exchange Security Groups,DC=mlabs,DC=com",
      "CN=BiscomUsers,OU=Security Groups,DC=mlabs,DC=com",
      "CN=DruvaADSync,OU=Security Groups,DC=mlabs,DC=com",
      "CN=IT Exchange User Management,OU=Microsoft Exchange Security Groups,DC=mlabs,DC=com",
      "CN=IT Support Technician,OU=Security Groups,DC=mlabs,DC=com",
      "CN=MH WLAN Access,OU=Security Groups,DC=mlabs,DC=com",
      "CN=NetworkIT,OU=Security Groups,DC=mlabs,DC=com",
      "CN=RDS Non-Admins,OU=Security Groups,DC=mlabs,DC=com",
      "CN=SharePoint Full Control,OU=Security Groups,DC=mlabs,DC=com",
      "CN=Signature-Generic-Phone-Fax-Email-O365,OU=Signature-O365,OU=Signatures,OU=Security Groups,DC=mlabs,DC=com"
    ],
    "distributionGroups": [
      "CN=Building 2,OU=Distribution Groups,DC=mlabs,DC=com",
      "CN=ITAlerts,OU=Distribution Groups,DC=mlabs,DC=com",
      "CN=Millennium Health,OU=Distribution Groups,DC=mlabs,DC=com"
    ]
  }
}
