{
  "schemaVersion": "2.0",
  "roleId": "Billing-Revenue_Cycle_Supervisor",
  "displayName": "Revenue Cycle Supervisor",
  "department": "Billing",
  "entitlements": {
    "securityGroups": [
      "CN=Billing Folder Access,OU=Access Groups,OU=Security Groups,DC=mlabs,DC=com",
      "CN=Billing Leadership,OU=Security Groups,DC=mlabs,DC=com",
      "CN=Billing Leads Folder Access,OU=Access Groups,OU=Security Groups,DC=mlabs,DC=com",
      "CN=Billing Patients Folder Access,OU=Access Groups,OU=Security Groups,DC=mlabs,DC=com",
      "CN=BiscomUsers,OU=Security Groups,DC=mlabs,DC=com",
      "CN=BT-FileXfers Folder Access,OU=Access Groups,OU=Security Groups,DC=mlabs,DC=com",
      "CN=Claims Only Printer,OU=Security Groups,DC=mlabs,DC=com",
      "CN=Correspondence (Billing) Folder access,OU=Access Groups,OU=Security Groups,DC=mlabs,DC=com",
      "CN=Credit Card Payments Folder Access,OU=Access Groups,OU=Security Groups,DC=mlabs,DC=com",
      "CN=Finance-Cash Posting Folder Access,OU=Access Groups,OU=Security Groups,DC=mlabs,DC=com",
      "CN=LF_Data ReEntry,OU=Security Groups,DC=mlabs,DC=com",
      "CN=LF_RC_BCBS_Read_Only,OU=Security Groups,DC=mlabs,DC=com",
      "CN=LF_RC_BILLING_MoveAccess,OU=Security Groups,DC=mlabs,DC=com",
      "CN=LF_RC_Commercial_Read_Only,OU=Security Groups,DC=mlabs,DC=com",
      "CN=LF_RC_Payments,OU=Security Groups,DC=mlabs,DC=com",
      "CN=LF_RevCycle_Full,OU=Security Groups,DC=mlabs,DC=com",
      "CN=LFBILLING_Accession_Access,OU=Security Groups,DC=mlabs,DC=com",
      "CN=LFBilling-ImportOnly,OU=Security Groups,DC=mlabs,DC=com",
      "CN=LFCash-Leads,OU=Security Groups,DC=mlabs,DC=com",
      "CN=LFLAB-DATAENTRY-eReq,OU=Security Groups,DC=mlabs,DC=com",
      "CN=LFLAB-DATAENTRY,OU=Security Groups,DC=mlabs,DC=com",
      "CN=LFRetrieve EOBs,OU=Security Groups,DC=mlabs,DC=com",
      "CN=LFRetrieve MedRecords,OU=Security Groups,DC=mlabs,DC=com",
      "CN=LFRetrieve PGT,OU=Security Groups,DC=mlabs,DC=com",
      "CN=LFScan Customer Service,OU=Security Groups,DC=mlabs,DC=com",
      "CN=LFScan MedRecords,OU=Security Groups,DC=mlabs,DC=com",
      "CN=LFWF Cash Management Users,OU=Security Groups,DC=mlabs,DC=com",
      "CN=LFWF InsuranceSpecialists,OU=Security Groups,DC=mlabs,DC=com",
      "CN=MH WLAN Access,OU=Security Groups,DC=mlabs,DC=com",
      "CN=ppshareusers,OU=Proofpoint,OU=Security Groups,DC=mlabs,DC=com",
      "CN=Read-Only Contracts Folder Access,OU=Access Groups,OU=Security Groups,DC=mlabs,DC=com",
      "CN=Report 00 QA Reports Folder Access,OU=Access Groups,OU=Security Groups,DC=mlabs,DC=com",
      "CN=Report 24 - Monthly Reports Folder Access,OU=Access Groups,OU=Security Groups,DC=mlabs,DC=com",
      "CN=Reports 10 - QAP Folder Access,OU=Access Groups,OU=Security Groups,DC=mlabs,DC=com",
      "CN=Request for Cash Posting Folder Access,OU=Access Groups,OU=Security Groups,DC=mlabs,DC=com",
      "CN=San Diego Leadership,OU=Security Groups,DC=mlabs,DC=com",
      "CN=Signature-Phone-Fax-Email-O365,OU=Signature-O365,OU=Signatures,OU=Security Groups,DC=mlabs,DC=com",
      "CN=Supervisors Folder Access in Billing Patients,OU=Access Groups,OU=Security Groups,DC=mlabs,DC=com"
    ],
    "distributionGroups": [
      "CN=Billing Supervisors,OU=Distribution Groups,DC=mlabs,DC=com",
      "CN=Bluffs ASR,OU=Distribution Groups,DC=mlabs,DC=com",
      "CN=Delayed Shipment Email,OU=Distribution Groups,DC=mlabs,DC=com",
      "CN=Millennium Health,OU=Distribution Groups,DC=mlabs,DC=com",
      "CN=Payment Processing Scrolling Marquee,OU=Distribution Groups,DC=mlabs,DC=com",
      "CN=Refund Requests,OU=Distribution Groups,DC=mlabs,DC=com",
      "CN=Refunds Department,OU=Distribution Groups,DC=mlabs,DC=com",
      "CN=Revenue Cycle All Employees B7,OU=Distribution Groups,DC=mlabs,DC=com"
    ]
  }
}
