{
  "schemaVersion": "2.0",
  "roleId": "IT-Manager_Quality_Assurance",
  "displayName": "Manager, Quality Assurance",
  "department": "IT",
  "entitlements": {
    "securityGroups": [
      "CN=AWS-741010255815-ADFS-QA,OU=AWS Access Groups,OU=Security Groups,DC=mlabs,DC=com",
      "CN=BiscomUsers,OU=Security Groups,DC=mlabs,DC=com",
      "CN=BT QA - MH,OU=Security Groups,DC=mlabs,DC=com",
      "CN=BTC_QA,OU=Security Groups,DC=mlabs,DC=com",
      "CN=DruvaADSync,OU=Security Groups,DC=mlabs,DC=com",
      "CN=ILIS Dev,OU=ILIS Non Prod Access Groups,OU=Security Groups,DC=mlabs,DC=com",
      "CN=ILIS QA,OU=ILIS Non Prod Access Groups,OU=Security Groups,DC=mlabs,DC=com",
      "CN=ILIS Sales User Dev,OU=ILIS Non Prod Access Groups,OU=Security Groups,DC=mlabs,DC=com",
      "CN=ILIS Sales User QA,OU=ILIS Non Prod Access Groups,OU=Security Groups,DC=mlabs,DC=com",
      "CN=IT Dept,OU=Security Groups,DC=mlabs,DC=com",
      "CN=Jira User Access,OU=Security Groups,DC=mlabs,DC=com",
      "CN=List-Only MLIS Interface Folder Access,OU=Access Groups,OU=Security Groups,DC=mlabs,DC=com",
      "CN=MH WLAN Access,OU=Security Groups,DC=mlabs,DC=com",
      "CN=QA,OU=Security Groups,DC=mlabs,DC=com",
      "CN=RDS Non-Admins,OU=Security Groups,DC=mlabs,DC=com",
      "CN=Read-Only Lab Document Control Folder Access,OU=Access Groups,OU=Security Groups,DC=mlabs,DC=com",
      "CN=SN MLIS Support,OU=ServiceNow Groups,OU=Security Groups,DC=mlabs,DC=com",
      "CN=SQL_BT_QA_MH,OU=SQL Security Groups,OU=Security Groups,DC=mlabs,DC=com"
    ],
    "distributionGroups": [
      "CN=Building 2,OU=Distribution Groups,DC=mlabs,DC=com",
      "CN=ILIS Alerts Nonprod,OU=Distribution Groups,DC=mlabs,DC=com",
      "CN=Millennium Health,OU=Distribution Groups,DC=mlabs,DC=com"
    ]
  }
}
