{
  "schemaVersion": "2.0",
  "roleId": "Marketing-Sr_VP_Market_Access",
  "displayName": "Sr. VP, Market Access",
  "department": "Marketing",
  "entitlements": {
    "securityGroups": [
      "CN=Audits - Medical Records Requests Folder Access,OU=Access Groups,OU=Security Groups,DC=mlabs,DC=com",
      "CN=BI_Executive,OU=BI,OU=Security Groups,DC=mlabs,DC=com",
      "CN=BiscomUsers,OU=Security Groups,DC=mlabs,DC=com",
      "CN=BTC_Authentication,OU=Security Groups,DC=mlabs,DC=com",
      "CN=BTC_Managed_Markets_Publish,OU=Security Groups,DC=mlabs,DC=com",
      "CN=BTC_Managed_Markets,OU=Security Groups,DC=mlabs,DC=com",
      "CN=BTC_Sales_Reps,OU=Security Groups,DC=mlabs,DC=com",
      "CN=BTC_TM,OU=Security Groups,DC=mlabs,DC=com",
      "CN=Contracts Folder Access,OU=Access Groups,OU=Security Groups,DC=mlabs,DC=com",
      "CN=Data Services Excel Data Sets Folder Access,OU=Access Groups,OU=Security Groups,DC=mlabs,DC=com",
      "CN=DxWound Medical Policy Documents Folder Access,OU=Access Groups,OU=Security Groups,DC=mlabs,DC=com",
      "CN=Finance-Legal Shared Docs,OU=Access Groups,OU=Security Groups,DC=mlabs,DC=com",
      "CN=Financial Review Data Folder Access,OU=Access Groups,OU=Security Groups,DC=mlabs,DC=com",
      "CN=Legal - Managed Markets Folder Access,OU=Access Groups,OU=Security Groups,DC=mlabs,DC=com",
      "CN=LF_AP_Approval,OU=Security Groups,DC=mlabs,DC=com",
      "CN=List-Only Billing Folder Access,OU=Access Groups,OU=Security Groups,DC=mlabs,DC=com",
      "CN=List-Only Contracts Folder Access,OU=Access Groups,OU=Security Groups,DC=mlabs,DC=com",
      "CN=List-Only Data Services Folder Access,OU=Access Groups,OU=Security Groups,DC=mlabs,DC=com",
      "CN=MH WLAN Access,OU=Security Groups,DC=mlabs,DC=com",
      "CN=ppshareusers,OU=Proofpoint,OU=Security Groups,DC=mlabs,DC=com",
      "CN=Provider News Folder Access,OU=Access Groups,OU=Security Groups,DC=mlabs,DC=com",
      "CN=Read-Only Sales Roster Folder Access,OU=Access Groups,OU=Security Groups,DC=mlabs,DC=com",
      "CN=Salesforce Inbox O365 Access,OU=Security Groups,DC=mlabs,DC=com",
      "CN=Signature-Default-Ext-Cell-O365,OU=Signature-O365,OU=Signatures,OU=Security Groups,DC=mlabs,DC=com",
      "CN=TableauAdmin,OU=Security Groups,DC=mlabs,DC=com",
      "CN=TableauExecutive,OU=Security Groups,DC=mlabs,DC=com"
    ],
    "distributionGroups": [
      "CN=Account Directors,OU=Distribution Groups,DC=mlabs,DC=com",
      "CN=Competitive Intelligence,OU=Distribution Groups,DC=mlabs,DC=com",
      "CN=Executive Team,OU=Distribution Groups,DC=mlabs,DC=com",
      "CN=Field Employees,OU=Distribution Groups,DC=mlabs,DC=com",
      "CN=Medical Policy,OU=Distribution Groups,DC=mlabs,DC=com",
      "CN=Millennium Health,OU=Distribution Groups,DC=mlabs,DC=com",
      "CN=NetSuite Approvers,OU=Distribution Groups,DC=mlabs,DC=com",
      "CN=Sales Status Changes,OU=Distribution Groups,DC=mlabs,DC=com",
      "CN=Sales Termination,OU=Distribution Groups,DC=mlabs,DC=com",
      "CN=Sales Training Presenters,OU=Distribution Groups,DC=mlabs,DC=com",
      "CN=UHC Reps,OU=Distribution Groups,DC=mlabs,DC=com",
      "CN=Weekly Email Distribution,OU=Distribution Groups,DC=mlabs,DC=com"
    ]
  }
}
