{
  "schemaVersion": "2.0",
  "roleId": "Legal-General_Counsel",
  "displayName": "General Counsel",
  "department": "Legal",
  "entitlements": {
    "securityGroups": [
      "CN=AD_BUSINESS_ANALYTICS,OU=Security Groups,DC=mlabs,DC=com",
      "CN=AD_BUSINESS_TECH,OU=Security Groups,DC=mlabs,DC=com",
      "CN=AD_CLINOPS,OU=Security Groups,DC=mlabs,DC=com",
      "CN=AD_COMMUNICATIONS,OU=Security Groups,DC=mlabs,DC=com",
      "CN=AD_COMMUNITY_STRATEGICAFFAIRS,OU=Security Groups,DC=mlabs,DC=com",
      "CN=AD_COMPLIANCE,OU=Security Groups,DC=mlabs,DC=com",
      "CN=AD_CONTRACT_MANAGER,OU=Security Groups,DC=mlabs,DC=com",
      "CN=AD_CREATIVE,OU=Security Groups,DC=mlabs,DC=com",
      "CN=AD_EDUCATION,OU=Security Groups,DC=mlabs,DC=com",
      "CN=AD_EMERGING_OPPS,OU=Security Groups,DC=mlabs,DC=com",
      "CN=AD_EVENTS_CONVENTIONS,OU=Security Groups,DC=mlabs,DC=com",
      "CN=AD_FACILITIES,OU=Security Groups,DC=mlabs,DC=com",
      "CN=AD_FINANCE_ACCOUNTING,OU=Security Groups,DC=mlabs,DC=com",
      "CN=AD_FINANCE_BILLING,OU=Security Groups,DC=mlabs,DC=com",
      "CN=AD_GLOBAL_DEFENSE,OU=Security Groups,DC=mlabs,DC=com",
      "CN=AD_GOVT_AFFAIRS,OU=Security Groups,DC=mlabs,DC=com",
      "CN=AD_HR,OU=Security Groups,DC=mlabs,DC=com",
      "CN=AD_LEGAL,OU=Security Groups,DC=mlabs,DC=com",
      "CN=AD_LOGISTICS,OU=Security Groups,DC=mlabs,DC=com",
      "CN=AD_MANAGED_CARE,OU=Security Groups,DC=mlabs,DC=com",
      "CN=AD_MARKETING,OU=Security Groups,DC=mlabs,DC=com",
      "CN=AD_PURCHASING,OU=Security Groups,DC=mlabs,DC=com",
      "CN=AD_SALESOPS,OU=Security Groups,DC=mlabs,DC=com",
      "CN=Audits - Medical Records Requests Folder Access,OU=Access Groups,OU=Security Groups,DC=mlabs,DC=com",
      "CN=BI_Executive,OU=BI,OU=Security Groups,DC=mlabs,DC=com",
      "CN=BI_Legal,OU=BI,OU=Security Groups,DC=mlabs,DC=com",
      "CN=BiscomUsers,OU=Security Groups,DC=mlabs,DC=com",
      "CN=Commercial Team Meeting Folder Access,OU=Access Groups,OU=Security Groups,DC=mlabs,DC=com",
      "CN=Commission Files Folder Access,OU=Access Groups,OU=Security Groups,DC=mlabs,DC=com",
      "CN=Cup Program Folder Access,OU=Access Groups,OU=Security Groups,DC=mlabs,DC=com",
      "CN=Discovery Management,OU=Microsoft Exchange Security Groups,DC=mlabs,DC=com",
      "CN=Legal L Drive Folder Access,OU=Access Groups,OU=Security Groups,DC=mlabs,DC=com",
      "CN=LF_AP_Approval,OU=Security Groups,DC=mlabs,DC=com",
      "CN=List-Only Billing Folder Access,OU=Access Groups,OU=Security Groups,DC=mlabs,DC=com",
      "CN=List-only Private Folder Access,OU=Access Groups,OU=Security Groups,DC=mlabs,DC=com",
      "CN=List-Only SalesOps Folder Access,OU=Access Groups,OU=Security Groups,DC=mlabs,DC=com",
      "CN=MH WLAN Access,OU=Security Groups,DC=mlabs,DC=com",
      "CN=NMHCo\\, Inc. - Corporate Secretary Folder Access,OU=Access Groups,OU=Security Groups,DC=mlabs,DC=com",
      "CN=Read-Only Workplan Folder Access,OU=Access Groups,OU=Security Groups,DC=mlabs,DC=com",
      "CN=San Diego Leadership,OU=Security Groups,DC=mlabs,DC=com",
      "CN=SharePoint Full Read,OU=Security Groups,DC=mlabs,DC=com",
      "CN=Signature-Generic-Phone-Fax-Email-O365,OU=Signature-O365,OU=Signatures,OU=Security Groups,DC=mlabs,DC=com",
      "CN=TableauAdmin,OU=Security Groups,DC=mlabs,DC=com",
      "CN=Via Tazon,OU=Security Groups,DC=mlabs,DC=com"
    ],
    "distributionGroups": [
      "CN=BOD \\+ AL MK BF,OU=Distribution Groups,DC=mlabs,DC=com",
      "CN=BOD \\+ Executive Team,OU=Distribution Groups,DC=mlabs,DC=com",
      "CN=Executive Team,OU=Distribution Groups,DC=mlabs,DC=com",
      "CN=Field Employees,OU=Distribution Groups,DC=mlabs,DC=com",
      "CN=MH Exec,OU=Distribution Groups,DC=mlabs,DC=com",
      "CN=MH Senior Leadership,OU=Distribution Groups,DC=mlabs,DC=com",
      "CN=Millennium Health,OU=Distribution Groups,DC=mlabs,DC=com",
      "CN=NetSuite Approvers,OU=Distribution Groups,DC=mlabs,DC=com",
      "CN=Sales Status Changes,OU=Distribution Groups,DC=mlabs,DC=com",
      "CN=Sales Training Presenters,OU=Distribution Groups,DC=mlabs,DC=com",
      "CN=Weekly Email Distribution,OU=Distribution Groups,DC=mlabs,DC=com"
    ]
  }
}
