{
  "schemaVersion": "2.0",
  "roleId": "Lab_Operations-Senior_Scientist",
  "displayName": "Senior Scientist ",
  "department": "Lab_Operations",
  "entitlements": {
    "securityGroups": [
      "CN=ACTR&D_Team,OU=Security Groups,DC=mlabs,DC=com",
      "CN=Associate Scientist,OU=Security Groups,DC=mlabs,DC=com",
      "CN=BI_LabOperations,OU=BI,OU=Security Groups,DC=mlabs,DC=com",
      "CN=BI_R&D,OU=BI,OU=Security Groups,DC=mlabs,DC=com",
      "CN=BiscomUsers,OU=Security Groups,DC=mlabs,DC=com",
      "CN=BLOCKYOUTUBE,OU=Security Groups,DC=mlabs,DC=com",
      "CN=BMRAM Application,OU=Security Groups,DC=mlabs,DC=com",
      "CN=Data Analysis and Review,OU=Security Groups,DC=mlabs,DC=com",
      "CN=Duo R&D,OU=Duo Access Groups,OU=Security Groups,DC=mlabs,DC=com",
      "CN=EP Evaluator,OU=Security Groups,DC=mlabs,DC=com",
      "CN=Instruments Lab Secure Transfer Folder Acces,OU=Access Groups,OU=Security Groups,DC=mlabs,DC=com",
      "CN=KB SharePoint Visitor,OU=Security Groups,DC=mlabs,DC=com",
      "CN=LabDR,OU=Security Groups,DC=mlabs,DC=com",
      "CN=R & D Folder Access,OU=Access Groups,OU=Security Groups,DC=mlabs,DC=com",
      "CN=R&D,OU=Security Groups,DC=mlabs,DC=com",
      "CN=Signature-Generic-Phone-Fax-Email-O365,OU=Signature-O365,OU=Signatures,OU=Security Groups,DC=mlabs,DC=com",
      "CN=SSRS MLIS Reports Lab Folder,OU=SQL Security Groups,OU=Security Groups,DC=mlabs,DC=com"
    ],
    "distributionGroups": [
      "CN=Building 1,OU=Distribution Groups,DC=mlabs,DC=com",
      "CN=Building 2,OU=Distribution Groups,DC=mlabs,DC=com",
      "CN=DAR,OU=Distribution Groups,DC=mlabs,DC=com",
      "CN=Instruments Lab,OU=Distribution Groups,DC=mlabs,DC=com",
      "CN=Millennium Health,OU=Distribution Groups,DC=mlabs,DC=com",
      "CN=R&D Drug Testing,OU=Distribution Groups,DC=mlabs,DC=com"
    ]
  }
}
